{
  "schema_version": "1.0",
  "kind": "research",
  "season": 2026,
  "week": 2,
  "model_version": "SIGNAL-2.0-pre-market",
  "generated_at": "2026-09-21T02:50:25Z",
  "content_hash": "8171ff6d66f0012998e7d100c2fd41572e87db0e3627763ad091b998ba5f6933",
  "frozen": false,
  "payload": {
    "title": "Week 2 Monday Night Gameflow Journal — Giants at Rams",
    "dek": "Pre-market football evaluation for New York at Los Angeles. Aaron Donald is now confirmed to play, while Puka Nacua is a game-time decision trending toward sitting and Deonte Banks/Micah McFadden remain unresolved; the thesis stays unfrozen until those late statuses are verified.",
    "games": [
      {
        "eventId": "NYG-LAR-2026-09-21",
        "matchup": "New York Giants @ Los Angeles Rams",
        "headline": "The central question is whether the Giants can sustain methodical offense while Los Angeles attacks a depleted New York secondary.",
        "thesis": "New York's Week 1 offense showed a credible possession-based identity built on varied personnel, run/pass sequencing and efficient third-down execution, but the Rams present a more disciplined Fangio-adjacent structure with better coverage rotation and renewed interior disruption now that Aaron Donald is confirmed to play. Los Angeles still owns the cleaner offensive matchup against a Giants secondary that has lost depth, but Puka Nacua's worsening availability materially lowers certainty around the Rams' normal receiving distribution. The most stable gameflow branch remains a competitive first half in which New York tries to shorten the game while Los Angeles tests the edges and intermediate middle. If the Giants fall behind by multiple scores, their methodical run-oriented identity becomes more fragile and Jaxson Dart's pressure recognition becomes a larger variable.",
        "defensiveWeakness": "The Giants' most important vulnerability is secondary depth. Paulson Adebo is on injured reserve and Deonte Banks missed both Friday and Saturday practice before being listed questionable, leaving Los Angeles with a clear incentive to stress replacement corners through Sean McVay's condensed formations, motion and layered route distribution. On the other side, the Rams are without Myles Garrett and Kamren Kinchens, but Aaron Donald is confirmed to return, restoring a high-impact interior disruption variable against New York's protection and run-game structure.",
        "offensiveResponse": "Los Angeles should still force New York to defend horizontally and through layered intermediate concepts before taking vertical shots, but Nacua's availability now has to be treated as a true branch rather than a minor tag. If Nacua sits, do not transfer his full workload to one receiver; expect broader redistribution toward Davante Adams, secondary wideouts, tight ends and the backs, with personnel usage potentially changing because Jordan Whittington is also doubtful. New York's best counter remains its Week 1 formula: stay ahead of the sticks, manipulate box counts with personnel and motion, lean on Cam Skattebo and the run game, and give Dart defined throws rather than obvious long-yardage dropbacks against Donald's return.",
        "personnelContext": "Material update: Aaron Donald is confirmed by Sean McVay to play Monday. Puka Nacua remains questionable after missing Friday and Saturday practice and is now described as a pregame decision trending the wrong way toward playing; Jordan Whittington remains doubtful and S Kamren Kinchens is out. For New York, CB Deonte Banks is questionable after back-to-back DNPs Friday and Saturday, while LB Micah McFadden is questionable after limited work. Myles Garrett is on injured reserve for Los Angeles. These unresolved statuses are material enough that the journal remains unfrozen.",
        "gameflow": "Base branch: New York attempts to compress possessions with a methodical run/pass mix while Los Angeles probes the weakened secondary. Donald's confirmed return raises the disruption risk for New York even in neutral scripts. A close first half still favors Giants rushing volume and short-area passing. A Rams lead of 10+ points pushes New York toward more dropbacks, raises Dart pressure exposure, and increases Rams pass-rush opportunity. Nacua's current negative trend increases the weight on the Rams-without-Puka branch; if he sits, receiving work should be redistributed across multiple roles rather than automatically awarded to one replacement.",
        "breaker": "Do not freeze this evaluation until Puka Nacua, Deonte Banks and Micah McFadden statuses are verified. Aaron Donald no longer belongs in the unresolved-status bucket: he is confirmed to play. A confirmed Nacua absence, Banks absence, major late offensive-line change, or unexpected Giants secondary reinforcement materially changes expected matchup exposure and should trigger a final rerun before freeze.",
        "sources": [
          {
            "title": "Reuters — Rams WR Puka Nacua sits out practice again, questionable vs. Giants",
            "url": "https://www.reuters.com/sports/rams-wr-puka-nacua-sits-out-practice-again-questionable-vs-giants--flm-2026-09-19/",
            "published_at": "2026-09-19T19:12:00Z"
          },
          {
            "title": "FOX Sports / Associated Press — Puka Nacua questionable, Aaron Donald set to play vs. Giants",
            "url": "https://www.foxsports.com/articles/nfl/puka-nacua-questionable-aaron-donald-set-to-play-for-rams-on-monday-night-against-giants",
            "published_at": "2026-09-19T19:13:00Z"
          },
          {
            "title": "Giants.com — Injury Report: Statuses for Giants vs. Rams on Monday Night Football",
            "url": "https://www.giants.com/news/injury-report-statuses-for-giants-vs-rams-on-monday-night-football",
            "published_at": "2026-09-19T19:30:00Z"
          },
          {
            "title": "Rams Wire via Yahoo Sports — Puka Nacua to be game-time decision but trending 'wrong way'",
            "url": "https://sports.yahoo.com/articles/rams-wr-puka-nacua-game-184718765.html",
            "published_at": "2026-09-20T18:47:00Z"
          },
          {
            "title": "Big Blue View — NY Giants-Rams matchup: Can New York offense keep rolling?",
            "url": "https://www.bigblueview.com/new-york-giants-analysis/171525/matchup-ny-offense-la-defense-jaxson-dart-cam-skattebo-malik-nabers-aaron-donald",
            "published_at": "2026-09-18T15:00:00Z"
          },
          {
            "title": "Big Blue View — NY Giants-Rams matchup: Los Angeles offense will provide stern test",
            "url": "https://www.bigblueview.com/new-york-giants-analysis/171643/matchup-ny-defense-la-offense-matthew-stafford-sean-mcvay-puka-nacua",
            "published_at": "2026-09-18T17:30:00Z"
          }
        ]
      }
    ],
    "qualifiedProps": []
  }
}